,covers_id,amazon_id,covers_title,amazon_title,similarity_score,covers_isbn,amazon_isbn,is_match
567,Covers_41883,Amazon_18756,My Racing Heart : The Passionate World of Thoroughbreds and the Track,Winner: My Racing Life,0.3404572236161498,9780060958084,9781409162391,False
568,Covers_22701,Amazon_3425,Friend of My Youth: Stories (Vintage Contemporaries),My Friend Leonard,0.39278459026655055,9780679729570,9780719561177,False
569,Covers_30650,Amazon_9509,It Takes a Village Idiot : Complicating the Simple Life,SIMPLE,0.33398126991414856,9780743211314,9781845338978,False
570,Covers_25095,Amazon_11174,Max and Ruby's Busy Week (Sticker Stories),Your Baby Week By Week,0.3642386279627895,9780448428536,9780091910556,False
571,Covers_38680,Amazon_6964,Lessons of the Locker Room: The Myth of School Sports,Room,0.3585558187262956,9780879758790,9780330519021,False
572,Covers_35951,Amazon_9172,"Le Livre de l'intranquillit?, ?dition int?grale",Le Freak,0.15053483224723044,9782267015164,9780751542776,False
573,Covers_22220,Amazon_10729,El Gatopardo,El principito,0.2458391754840508,9788401418938,9788498381498,False
574,Covers_31545,Amazon_9881,Friends for 350 Years: The History and Beliefs of the Society of Friends Since George Fox Started the Quaker Movement,Cooking for Family and Friends,0.2947964959565962,9780875749037,9781509820252,False
575,Covers_15883,Amazon_5094,By Starlight (Berkley Sensation),Days of Blood and Starlight,0.3787656561094229,9780425191033,9781444722703,False
576,Covers_27584,Amazon_21634,Inspecting the Vaults (Penguin Short Fiction),Inspecting the Aging Sailboat,0.3704362502525714,9780140096361,9780071445450,False
577,Covers_37749,Amazon_1946,"Understanding Macbeth: A Student Casebook to Issues, Sources, and Historical Documents (The Greenwood Press \Literature in Context\"" Series)""",Macbeth,0.2884323530590225,9780313296307,9781107615496,False
578,Covers_14752,Amazon_11391,"Childhood Rising: The Astrology of Your Mother, Your Father, and You",You're Not Crazy - It's Your Mother,0.3414355509353498,9780440216384,9780232529296,False
579,Covers_28302,Amazon_14614,"Nightmare of Ecstasy: The Life and Art of Edward D. Wood, Jr.",The Wood,0.39648298096500256,9780922915248,9780857524584,False
580,Covers_6294,Amazon_8705,A Few Short Notes on Tropical Butterflies : Stories,Best Short Stories,0.32699256929875276,9780060509286,9780486289182,False
581,Covers_29057,Amazon_15792,Fathers and Sons (Oxford World's Classics),The Desert Fathers,0.3976653224733181,9780192833921,9780140447316,False
582,Covers_29724,Amazon_20972,Double Disillusion,Double Dork Diaries,0.31052235205150336,9780734400239,9780857072184,False
583,Covers_35007,Amazon_15591,Le Morte Darthur (Wordsworth Classics of World Literature),The Literature Book,0.3098945986805745,9781853264634,9780241015469,False
584,Covers_47728,Amazon_3826,"What Color Is Your Personality?: Red, Orange, Yellow, Green... (Gift Books)",What Color Is Your Parachute? 2019,0.3561816523233676,9781561706518,9780399581687,False
585,Covers_6715,Amazon_22155,Crackpot: The Obsessions of John Waters,Greek Waters Pilot,0.28408681115064727,9780743246279,9781846239502,False
586,Covers_47140,Amazon_19792,The Protest,The Story of the World,0.08394128781079635,9780972349888,9781933339054,False
587,Covers_19152,Amazon_1385,I Know Numbers (Preschool) (Step Ahead Golden Books Workbook),Numbers Workbook Ages 3-5: New Edition,0.36836402093374454,9780307036711,9780008151553,False
588,Covers_18718,Amazon_17020,Golden Dawn Enochian Magic (Llewellyn's High Magick Series),Blood Magick,0.3240114968843422,9780875428987,9780425259870,False
589,Covers_14119,Amazon_7904,Jack Holborn (Oxford Children's Modern Classics),Oxford Children's Dictionary,0.3881776438070533,9780192718082,9780192744012,False
590,Covers_5621,Amazon_7586,Killer in Drag,The Crucifix Killer,0.3235606523403912,9781568581200,9781471128219,False
591,Covers_22139,Amazon_1000,Daniel Faces the Lion (Beginners Bible Very First Adventures),Lion,0.3693165830227897,9780679875253,9781405930994,False
592,Covers_10341,Amazon_7068,"Man's Origin, Man's Destiny: A Critical Survey of the Principles of Evolution and Christianity",Origin,0.3423337791072276,9780871233561,9780552175692,False
593,Covers_15564,Amazon_6599,Crossword Key (Longman Pocket Companion Series),New Comprehensive A-Z Crossword Dictionary,0.3116838050922462,9780582556508,9780380724253,False
594,Covers_736,Amazon_20912,The Treasure of the Sierra Madre,Treasure Island,0.33683299968766467,9780809001606,9780141321004,False
595,Covers_13388,Amazon_10697,"Diederichs Gelbe Reihe, Bd.33, Indische Mythen und Symbole",Berserk Volume 33,0.1866799666860173,9783424006933,9781595823724,False
596,Covers_27573,Amazon_19792,The Impersonator,The Story of the World,0.07903835058657858,9780440214168,9781933339054,False
597,Covers_25253,Amazon_15524,Sally Hemings : A Novel,The Novel Cure,0.14800374372013264,9780312247041,9780857864215,False
598,Covers_29854,Amazon_15733,The Englishman's Daughter: A True Story of Love and Betrayal in World War One,The War of the World,0.3854353882285275,9780374129859,9780141013824,False
599,Covers_46556,Amazon_7584,Good Bye Ouchies and Grouchies  Hello Happy Feelings: Eft for Kids of All Ages,The Long Good-bye,0.30884507800005245,9780964216723,9780241954362,False
600,Covers_15483,Amazon_11982,Covenant With the Vampire: The Diaries of the Family Dracul,The Family,0.3811150743889389,9780385313131,9780060560058,False
601,Covers_3891,Amazon_7354,"Ronia, the Robber's Daughter",The Daughter Of Time,0.33568590711113494,9780140317206,9780099536826,False
602,Covers_33792,Amazon_1022,How to Trace Your Family Tree: A Complete and Easy to Understand Guide for the Beginner.,How To,0.35031633497473924,9780385098854,9781473680326,False
603,Covers_25280,Amazon_13134,Ford: We Never Called Him Henry,Him & Me,0.36903169329146546,9780812594027,9781405911375,False
604,Covers_10193,Amazon_20077,"Cut the Fat, Not the Muscle: Cost Improvement Strategies for Long-Term Profitability",Stocks for the Long Run 5/E: The Definitive Guide to Financial Market Returns & Long-Term Investment Strategies,0.32694401285265,9780132924436,9780071800518,False
605,Covers_42804,Amazon_1927,Madita. ( Ab 8 J.).,"The AB Guide to Music Theory, Part I",0.2795045518201549,9783789141058,9781854724465,False
606,Covers_44418,Amazon_14038,L'Amour aux temps du chol?ra,Ra Material: An Ancient Astronaut Speaks (Book One),0.20587855333430968,9782246376316,9780898652604,False
607,Covers_20181,Amazon_1292,Wealthy and Wise: Secrets About Money,Money,0.3945491934605412,9780471221418,9781784874025,False
608,Covers_35562,Amazon_16616,The Eureka Effect: The Art and Logic of Breakthrough Thinking,The Logic of God,0.3826541620621827,9780393322552,9780310454038,False
609,Covers_15705,Amazon_13918,Marriage Between Equals Studies from Life and Litera,Between Life and Death,0.3711563944030949,9780385020855,9781940265001,False
610,Covers_17141,Amazon_16074,A Capeside Christmas,The Book of Christmas,0.3759529790508761,9780671775414,9780091947293,False
611,Covers_23814,Amazon_21936,Three Moons in Vietnam: A Haphazard Journey by Boat and Bicycle,The Bicycle Book,0.3460727272654499,9780349107387,9780241226117,False
612,Covers_3671,Amazon_2641,The Positronic Man,I'm Your Man,0.31882474711087355,9780553561210,9780099549321,False
613,Covers_29868,Amazon_13303,Best Friends (Life Favors),Snoopy & Woodstock: Best Friends,0.33492200113323334,9780679884095,9780762438143,False
614,Covers_11948,Amazon_20848,"Books, Books, Books: A Hilarious Collection of Literary Cartoons",The Little House Books,0.38013433000250885,9780060160043,9780064400404,False
615,Covers_48541,Amazon_2118,How a Man Prepares His Daughters for Life (Lifeskills for Men),An Actor Prepares,0.3206171329660063,9781556618451,9781780938431,False
616,Covers_12003,Amazon_12510,"Vaccinations: A Thoughtful Parent's Guide: How to Make Safe,  Sensible Decisions about the Risks, Benefits, and Alternatives",The Thoughtful Gardener,0.25239052332298234,9780892819317,9781910254592,False
617,Covers_13850,Amazon_3673,"Where the Wolf Leads (Harlequin Romance, #2396)",Way of the Wolf,0.299140705943435,9780373023967,9781473674813,False
618,Covers_4737,Amazon_16296,The Divine Child: A Novel of Prenatal Rebellion,The Divine Dance,0.33778957762207557,9780316114042,9780281078158,False
619,Covers_24317,Amazon_15626,The Spoils of Poynton (World's Classics),The World,0.30996520117209225,9780192816054,9781786576538,False
620,Covers_1785,Amazon_19792,The Pine Barrens,The Story of the World,0.058560680016696204,9780374514426,9781933339054,False
621,Covers_3746,Amazon_1465,John Dos Passos : U.S.A. : The 42nd Parallel / 1919 / The Big Money (Library of America),Parallel Worlds,0.26957038000560446,9781883011147,9780141014630,False
622,Covers_1142,Amazon_10245,The Assassination of Jesse James by the Coward Robert Ford,"Assassination Classroom, Vol. 1",0.2841011196198594,9780060976996,9781421576077,False
623,Covers_45101,Amazon_14424,Down by the Dockside (Penguin Australian Library),The Australian Bird Guide,0.30511036095448707,9780140075069,9780691173016,False
624,Covers_11818,Amazon_1372,"Treasures on Earth: Museums, Collections and Paradoxes",Life on Earth,0.3252448443369331,9780571212958,9780008294281,False
625,Covers_24472,Amazon_21636,Generation S.L.U.T. : A Brutal Feel-up Session with Today's Sex-Crazed Adolescent Populace,Feel,0.27706456081163844,9780743471091,9780753545614,False
626,Covers_36229,Amazon_6314,Parks of Malaysia: A practical guide and manual,Practical Guide To Patchwork,0.29778076198499037,9789837407879,9781607050087,False
627,Covers_37244,Amazon_6691,Careers for Nonconformists: A Practical Guide to Finding and Developing a Career Outside the Mainstream,Outside the Lines,0.2513810443671101,9781569246849,9780399162084,False
628,Covers_29546,Amazon_5136,Poet's Guide: How to Publish and Perform Your Work (Slp Writers' Guide),Poems to Perform,0.3647001091974472,9781885266002,9781447243397,False
629,Covers_41595,Amazon_10416,"Diana-Taschenb?cher, Nr.14, Das Zimthaus",Berserk Volume 14,0.1971700499879045,9783453150225,9781593075019,False
630,Covers_46111,Amazon_11570,Das Schimmern der Flgel: Jugendmythen,Das Reich,0.19457114099888592,9783250102342,9780330509985,False
631,Covers_20327,Amazon_13700,Histoire secrte de Lyon et du Lyonnais (Histoire secrte des provinces franaises),Tao Te Ching,0.22504277697709058,9782226005137,9780486297927,False
632,Covers_40823,Amazon_17458,One Bride:Baby Included,The One,0.3662328883690929,9780373196739,9781785035623,False
633,Covers_43846,Amazon_8030,The Blue Devil (Zebra Regency Romance),The Devil's Dictionary,0.3802161724988396,9780821770498,9780486275420,False
634,Covers_3684,Amazon_15626,Winesburg Ohio (Oxford World's Classics),The World,0.2642903210858666,9780192839770,9781786576538,False
635,Covers_2113,Amazon_10511,Noces Suivi De L'Ete (Folio Series : No 16),Berserk Volume 16,0.22180365744901576,9782070360161,9781593077068,False
636,Covers_43945,Amazon_4844,"Percival Pea, And, Polly Pomegranate",Princess Polly's Potty,0.28524118709280954,9780721406039,9781409302193,False
637,Covers_13100,Amazon_19805,Made for Happiness: Discovering the Meaning of Life With Aristotle,Reading with Meaning,0.3803576090560175,9780887846694,9781571109552,False
638,Covers_40769,Amazon_447,Culpeper's Complete Herbal: A Book of Natural Remedies of Ancient Ills (The Wordsworth Collection Reference Library),The Complete Book Of Ayurvedic Home Remedies,0.30794128387550695,9781853263453,9780749927653,False
639,Covers_17094,Amazon_12106,Baroque and Desperate (Den of Antiquity),The World of Late Antiquity,0.36064190287761977,9780380802258,9780500330227,False
640,Covers_5787,Amazon_20307,"Emile: Or, On Education",Education of the Child,0.3645564500454085,9780465019311,9780880104142,False
641,Covers_12704,Amazon_17341,Rockfort Snow,Kiss of Snow,0.39094387443046397,9781401045371,9780425244890,False
642,Covers_22505,Amazon_13485,Did Adam &amp; Eve Have Bellybuttons...And 199 other questions from Catholic Teenagers,Teenagers,0.328884338153227,9780965922807,9781785211034,False
643,Covers_10781,Amazon_10197,"Overlord'S Bride (The Warrior Series) (Harlequin Historical Series, No 559)","Overlord, Vol. 1 (light novel)",0.29571718083070614,9780373291595,9780316272247,False
644,Covers_15242,Amazon_14387,"Boss In A Million (9 To 5) (Presents, 2095)",A Million Cats,0.35114195429010947,9780373120956,9781782435693,False
645,Covers_44366,Amazon_5524,Tin Cup Dreams : A Long Shot Makes it on the PGA Tour,A Tour of C++,0.3166947101207896,9780786886470,9780321958310,False
646,Covers_2421,Amazon_9436,"CONQUEST: CORTES, MONTEZUMA, AND THE FALL OF OLD MEXICO",Mexico,0.3825992658439126,9780671511043,9780714867526,False
647,Covers_11291,Amazon_3724,High Waving Heather (Phoenix 60p Paperbacks),The Phoenix Project,0.27060248328147846,9781857995459,9781942788294,False
648,Covers_19192,Amazon_2521,Pensar La Matematica,La La Land,0.2888703269797798,9788472236141,9780571539826,False
649,Covers_12339,Amazon_19275,Stories and Poems for Extremely Intelligent Children of All Ages,Art of Conversation - All Ages,0.34347248321225105,9780684868738,9780646462141,False
650,Covers_30987,Amazon_5554,Il faudra bien se r?soudre ? mourir seul,OCA / OCP Java SE 8 Programmer Certification Kit,0.11446619207605882,9782207303634,9781119272090,False
651,Covers_10413,Amazon_2539,Angel by My Side: Lily's Story (An Avon Camelot book),My Story,0.3588806734619226,9780380782543,9781589793163,False
652,Covers_18018,Amazon_5382,Die geheime Inquisition. Aus den verbotenen Archiven des Vatikan.,The Art Of Dragon Age: Inquisition,0.24531093953680885,9783548602011,9781616551865,False
653,Covers_3755,Amazon_12543,Taking Chances (Heartland (Scholastic Paperback)),Taking Care of Myself,0.26923838686619156,9780439130257,9781885477941,False
654,Covers_9432,Amazon_13107,O Viajante Imovel: Machado de Assis E O Rio de Janeiro de Seu Tempo,The De-Textbook,0.24544434878349597,9788501057709,9780452298200,False
655,Covers_1537,Amazon_4001,"Rule No. 5, No Sex on the Bus: Confessions of a Tour Leader",Rule #1,0.39098091843423954,9781865085531,9781905211319,False
656,Covers_33137,Amazon_19626,Country Afghans: The Vanessa-Ann Collection,Vanessa Tarot Deck,0.3794473842435777,9780848714185,9781572815742,False
657,Covers_44314,Amazon_12804,Das Cottage hinter den Feldern.,Life in a Cottage Garden,0.2975353813362699,9783404148844,9781846078712,False
658,Covers_24891,Amazon_19994,Maria Jeritza: Primadonna des Verismo,Maria Montessori,0.2868252971026399,9783215043659,9780452279896,False
659,Covers_24318,Amazon_5934,MCSE Windows NT Server 4.0 Study Guide (Exam 70-67),MCSA Windows Server 2012 R2 Complete Study Guide,0.35762515664472433,9780078824913,9781118859919,False
660,Covers_35534,Amazon_5536,FROMKIN/RODMAN INTRODUCTION TO LANGUAGE 4E IE,"C# in Depth, 4E",0.27844273535555875,9780030267222,9781617294532,False
661,Covers_15233,Amazon_15524,Motherland: A Novel,The Novel Cure,0.19389624256808544,9781569472170,9780857864215,False
662,Covers_23436,Amazon_9407,India: Granta 57 (Granta (Viking)),India,0.3406939411656106,9780140141474,9780714859026,False
663,Covers_9194,Amazon_19792,The Killeen,The Story of the World,0.07903835058657858,9780552992039,9781933339054,False
664,Covers_49158,Amazon_13903,Pregnancy As Healing: Holistic Philosophy for Prenatal Care,Holistic Tarot,0.3229065219024449,9780939508044,9781583948354,False
665,Covers_19833,Amazon_21152,Passion Never Knows (Kincaid Trilogy),Passion,0.3938941461690999,9780747235460,9780552561792,False
666,Covers_46582,Amazon_1084,Un grand pas vers le bon Dieu,The Grand Design,0.2536614784848897,9782246407119,9780553819229,False
667,Covers_38403,Amazon_16943,Christy Series #3: The Angry Intruder,The Angry Tide,0.3882227214863144,9780849936883,9780330463300,False
668,Covers_37634,Amazon_12463,Bent Halos and Other Saintly Stories: The Lives of One Hundred Saintly Men and Women,The One Hundred,0.31592521094276754,9780818908620,9780061664618,False
669,Covers_26062,Amazon_22610,Marco's Convenient Wife  (Wedlocked!),Travels Of Marco Polo,0.3090518909873871,9780373123148,9780451529510,False
670,Covers_42630,Amazon_16430,The Carpenter's Apprentice: The Spiritual Biography of Jimmy Carter,More Than A Carpenter,0.3314379381162659,9780310200123,9781414326276,False
671,Covers_30002,Amazon_8970,Liebe in fremden Betten.,Queen in 3-D,0.09368359694577134,9783216306111,9781999667429,False
672,Covers_25000,Amazon_3245,"Return Engagement (Settling Accounts Trilogy, Book 1)",The Return,0.34854899953272755,9780345457233,9780241966280,False
673,Covers_13227,Amazon_7243,The Bluebird and the Sparrow (Janette Oke Classics for Girls),Red Sparrow,0.3463031381085387,9780764227127,9781471166129,False
674,Covers_10767,Amazon_9362,1001 Simple Ways to Lose Weight: Proven Tips for Losing Those Extra Pounds-- And Keeping Them of,Lose Weight for Good,0.3522524283436731,9780809230808,9781472949295,False
675,Covers_26573,Amazon_19225,MAN-KZIN WARS VII : MAN-KZIN WARS VII,Star Wars,0.30360019145635575,9780671876708,9781633440272,False
676,Covers_31944,Amazon_14503,Birds of Prey! (Know-It-Alls),World of Birds,0.36138001328939506,9780768102321,9781925546521,False
677,Covers_25061,Amazon_2521,La lenteur: Roman,La La Land,0.35259588305791595,9782070741359,9780571539826,False
678,Covers_17923,Amazon_14987,Every Young Man's Battle: Strategies for Victory in the Real World of Sexual Temptation (The Every Man Series),Make Every Man Want You,0.38072571597003524,9781578565375,9780071597814,False
679,Covers_49556,Amazon_2096,Viking Magic (Postcards From Europe) (Harlequin Presents No 1691),Postcards From Penguin,0.3829294810368768,9780373116911,9780141044668,False
680,Covers_38937,Amazon_17699,"Of Quests and Kings (Castaways in Time, No 3)",The Way of Kings,0.3525842508512826,9780451145741,9780765365279,False
681,Covers_16469,Amazon_14803,"By Any Other Fame (Daw Book Collectors, No. 940)",Any Ordinary Day,0.2260275463086938,9780886775940,9780143789963,False
682,Covers_4124,Amazon_10101,The Cove: An FBI Thriller (FBI Thriller (G.P. Putnam's Sons)),Smugler's Cove,0.2062348605816583,9780399150869,9781607747321,False
683,Covers_18375,Amazon_20065,"Cybershock: Surviving Hackers, Phreakers, Identity Thieves, Internet Terrorists and Weapons of Mass Disruption",Weapons of Mass Instruction,0.3349325341267223,9781560253075,9780865716698,False
684,Covers_29096,Amazon_1042,Invisible Me (Sweet Valley Jr High),Invisible Women,0.38883659697784395,9780553487251,9781784741723,False
685,Covers_45746,Amazon_7732,A Catered Murder,The Murder Stone,0.31877903599878055,9781575667102,9780751547535,False
686,Covers_24635,Amazon_8042,Tuareg/Tuareg (Spanish ed.),Spanish Stories,0.26713375497213565,9788401499128,9780486253992,False
687,Covers_26283,Amazon_3058,"Kristy and Mr. Mom (Baby-Sitters Club, 81)",Mom and Me and Mom,0.3784716362833952,9780590482257,9781844089154,False
688,Covers_46758,Amazon_21331,An English madam: The life and work of Cynthia Payne,My Life and Work,0.34799860713248676,9780224020374,9780979311987,False
689,Covers_20816,Amazon_6314,Copyediting: A Practical Guide,Practical Guide To Patchwork,0.3856835720138487,9781560526087,9781607050087,False
690,Covers_25848,Amazon_17053,King Arthurs Place In Prehistory the Gre,The King,0.32646751266309476,9781858337692,9780451417060,False
691,Covers_38971,Amazon_6502,Rock-A-Doodle: Movie Novelization Plus an Eight Page Photo Insert,Craft-a-Doodle,0.2649277578505648,9780816724758,9781454704225,False
692,Covers_22114,Amazon_10400,"Hell Raiser (Harlequin Historical, No 45)",From Hell,0.34793838191175847,9780373286454,9780861661411,False
693,Covers_713,Amazon_14897,"Pride Of Jared Mackade (The Mackade Brothers/) (Silhouette Special Edition, No 1000)",The $1000 Project,0.24354035231172277,9780373240005,9780143788089,False
694,Covers_11409,Amazon_2521,Don Quixote de La Mancha (Modern Library),La La Land,0.25211372512751207,9780679602866,9780571539826,False
695,Covers_19163,Amazon_19038,Italie du Nord 2003,Pays Du Mont-Blanc 2003,0.32557591465012314,9782012437272,9782841822065,False
696,Covers_29789,Amazon_4896,"Betrayed (Harlequin Presents, No 1492)",No Means No!,0.17355487505488096,9780373114924,9781925089226,False
697,Covers_20074,Amazon_20651,"Thornton Wilder's Our Town, the Bridge of San Luis Rey, and Other Works",The Works,0.2688073158538797,9780671006990,9780143112709,False
698,Covers_46019,Amazon_9172,Le Li?vre de Vatanen,Le Freak,0.17306065726905676,9782070386024,9780751542776,False
699,Covers_3398,Amazon_15083,Der Kuss meiner Schwester,Harry Potter Und Der Stein Der Weisen,0.167063901156703,9783785531228,9783551354013,False
700,Covers_23400,Amazon_16633,Gardens from the Sand: A Story About Looking for Answers &amp; Finding Miracles,Miracles,0.36250693701205283,9780062510532,9780007461257,False
701,Covers_45572,Amazon_6208,Central Auditory Processing Disorders: New Perspectives,"101 Games and Activities for Children With Autism, Asperger's and Sensory Processing Disorders",0.28648695008895864,9781565936973,9780071623360,False
702,Covers_39916,Amazon_11471,Operation: Texas : The Special Agents (Superromance),Special,0.3588094285012293,9780373712274,9781925384680,False
703,Covers_20994,Amazon_1814,Building Mental Muscle : Conditioning Exercises for the Six Intelligence Zones,Muscle Book,0.34790708672266085,9780916410629,9780893892630,False
704,Covers_21407,Amazon_17604,There's Nothing in the Middle of the Road but Yellow Stripes and Dead Armadillos : A Work of Political Subversion,Nothing But Trouble,0.29617905326580674,9780060929497,9780061579097,False
705,Covers_9100,Amazon_19290,The Potato: How the Humble Spud Rescued the Western World,The Potato Factory,0.36462966032506017,9780865475786,9780143004561,False
706,Covers_5214,Amazon_6908,A Summons to Memphis (Vintage International (Paperback)),Vintage Flowers,0.22124058240744784,9780375701177,9781856269711,False
707,Covers_33014,Amazon_10416,"Ilse Janda, 14 oder Die Ilse ist weg.",Berserk Volume 14,0.15822184747901386,9783789120626,9781593075019,False
708,Covers_18167,Amazon_17551,Blackmailed Bride (Harlequin Intrigue 575),Devil's Bride,0.25071660648099453,9780373225750,9780380794560,False
709,Covers_17274,Amazon_16485,The Absent Author (A to Z Mysteries),The Book of Mysteries,0.31353223800651625,9780679881681,9781629989419,False
710,Covers_22788,Amazon_2167,Rambo III,Diablo III,0.37487018025544266,9780515093339,9781608870639,False
711,Covers_31205,Amazon_3692,Let's Find Bunny,Find Your Why,0.39382453738095385,9780307331021,9780143111726,False
712,Covers_11092,Amazon_1292,"The Case of the Funny Money Man (The Clue Kids, No 1)",Money,0.3666160464509232,9780816716937,9781784874025,False
713,Covers_23602,Amazon_3771,"Slave Counterpoint: Black Culture in the Eighteenth-Century Chesapeake and Lowcountry (Published for the Omohundro Institute of Early American History and Culture, Williamsburg, Virginia)",The Culture Code,0.27333441269468994,9780807847176,9781847941275,False
714,Covers_14873,Amazon_9338,"Maggie'S Man (Harlequin Desire, No 587)",Maggie's Harvest,0.393065240600354,9780373055876,9781920989545,False
715,Covers_18164,Amazon_3552,Start Quilting With Alex Anderson: Six Projects for First-Time Quilters,Start With Why,0.2930201957395807,9781571200297,9780241958223,False
716,Covers_12143,Amazon_21070,Will You Miss Me When I'm Gone?: The Carter Family and Their Legacy in American Music,Gone,0.3200554995281024,9780684857633,9781405277044,False
717,Covers_13846,Amazon_11677,Rebel Yell 2: More Stories of Contemporary Southern Gay Men,The Rebel,0.372974759735645,9781560231592,9780141182018,False
718,Covers_16144,Amazon_2924,"Stacey and the Stolen Hearts (Baby-Sitters Club Mystery, 33)",Stolen Life,0.3499528603457493,9780590059732,9781451673708,False
719,Covers_29502,Amazon_4849,On the Road With Charles Kuralt,Road,0.396390485917173,9780399130878,9780307386458,False
720,Covers_28890,Amazon_20702,The Modern Us War Machine: An Encyclopedia of American Military Equipment and Strategy,Military Strategy: A Very Short Introduction,0.3514144625413823,9780517560976,9780199340132,False
721,Covers_39799,Amazon_6815,Trixie Belden and the Black Jacket Mystery (Trixie Belden),The Couture Cardigan Jacket,0.19602028674572594,9780307215413,9781600859557,False
722,Covers_44295,Amazon_18224,"The State of Working America, 1998-99 (Paper)",The State Of The Art,0.3654775437248886,9780801485824,9781857230307,False
723,Covers_9376,Amazon_993,The Habit of Thought:  From Socratic Seminars to Socratic Practice,The Power of Habit,0.268541313916086,9780944337394,9781847946249,False
724,Covers_9269,Amazon_3306,Passing into Light,First Light,0.3734349208367075,9781590520666,9780141042756,False
725,Covers_21883,Amazon_5618,"Approaching Zero: The Extraordinary Underworld of Hackers, Phreakers, Virus Writers, and Keyboard Criminals",Hackers,0.3300955955994751,9780679409380,9781449388393,False
726,Covers_16719,Amazon_15083,Haut und Haar.,Harry Potter Und Der Stein Der Weisen,0.12612942255161033,9783453137585,9783551354013,False
727,Covers_32693,Amazon_3928,Gung Ho! Turn On the People in Any Organization,The Fearless Organization,0.2895948029035601,9780688154288,9781119477242,False
728,Covers_2136,Amazon_7370,The Dark Elf Trilogy Collector's Edition (Forgotten Realms: Dark Elf Trilogy),"In a Dark, Dark Wood",0.3392819096352137,9780786915880,9780099598244,False
729,Covers_16077,Amazon_21417,Mariposa Blues (An Avon Flare Book),Baby Blues,0.32282638809966974,9780380717613,9780809239962,False
730,Covers_44765,Amazon_19792,The Rabbi's Heartbeat,The Story of the World,0.0639149202001343,9781576834695,9781933339054,False
731,Covers_5083,Amazon_19792,The Stray,The Story of the World,0.07903835058657858,9780679891017,9781933339054,False
732,Covers_4858,Amazon_15144,Mrs. Jeffries Reveals Her Art (Victorian Mysteries),Her,0.3321290669814536,9780425162439,9780997426588,False
