,covers_id,amazon_id,covers_title,amazon_title,similarity_score,covers_isbn,amazon_isbn,is_match
1405,Covers_2229,Amazon_15059,Alice's Adventures in Wonderland and Through the Looking-Glass: And What Alice Found There (Penguin Classics),Alice's Adventures in Wonderland and Through the Looking Glass,0.8103985084369273,9780141439761,9780141439761,True
1406,Covers_8178,Amazon_11366,The Dance of Intimacy: A Woman's Guide to Courageous Acts of Change in Key Relationships,The Dance of Intimacy,0.5079076982446538,9780060916466,9780060916466,True
1407,Covers_3815,Amazon_12078,The Second Treatise of Government and a Letter Concerning Toleration (Dover Thrift Editions),The Second Treatise of Government: AND A Letter Concerning Toleration,0.8831522621274285,9780486424644,9780486424644,True
1408,Covers_5414,Amazon_16061,The Penguin Historical Atlas of Ancient Rome (Penguin Historical Atlases),The Penguin Historical Atlas of Ancient Rome,0.8492223694719078,9780140513295,9780140513295,True
1409,Covers_3525,Amazon_79,Hands of Light: A Guide to Healing Through the Human Energy Field,Hands Of Light,0.5224491487030002,9780553345391,9780553345391,True
1410,Covers_3678,Amazon_3471,The Journey Home: A Kryon Parable : The Story of Michael Thomas and the Seven Angels (Kryon (Paperback)),The Journey Home,0.3073267613349659,9781561705528,9781561705528,True
1411,Covers_3195,Amazon_19820,The Moscow Puzzles : 359 Mathematical Recreations (Math &amp; Logic Puzzles),The Moscow Puzzles,0.6169421581378467,9780486270784,9780486270784,True
1412,Covers_4863,Amazon_11721,A Practical Guide to the Runes: Their Uses in Divination and Magick (Llewellyn's New Age),A Practical Guide to the Runes,0.5175464619208591,9780875425931,9780875425931,True
1413,Covers_7251,Amazon_16396,Jesus Among Other Gods The Absolute Claims Of The Christian Message,Jesus Among Other Gods,0.5980654781446617,9780849943270,9780849943270,True
1414,Covers_7742,Amazon_1743,Reason for Hope : A Spiritual Journey,Reason For Hope,0.7776297475240543,9780446676137,9780446676137,True
1415,Covers_4664,Amazon_14155,The Other End of the Leash: Why We Do What We Do Around Dogs,Other End of the Leash,0.5209447128249718,9780345446787,9780345446787,True
1416,Covers_4938,Amazon_11416,"Perfect Health: The Complete Mind/Body Guide, Revised and Updated Edition",Perfect Health--Revised and Updated,0.7562891105161257,9780609806944,9780609806944,True
1417,Covers_5814,Amazon_597,The Second Brain : A Groundbreaking New Understanding of Nervous Disorders of the Stomach and Intestine,The Second Brain,0.37784537474577595,9780060930721,9780060930721,True
1418,Covers_2806,Amazon_7519,One Day in the Life of Ivan Denisovich (Penguin Modern Classics),One Day in the Life of Ivan Denisovich,0.8756055589958359,9780141184746,9780141184746,True
1419,Covers_2649,Amazon_12112,Cunningham's Encyclopedia of Magical Herbs (Llewellyn's Sourcebook Series),Encyclopaedia of Magical Herbs,0.4230424096599481,9780875421223,9780875421223,True
1420,Covers_8194,Amazon_1040,The Demon-Haunted World: Science As a Candle in the Dark,The Demon-Haunted World,0.6527852566510957,9780345409461,9780345409461,True
1421,Covers_1262,Amazon_5185,Green Eggs and Ham (I Can Read It All by Myself Beginner Books),Green Eggs and Ham,0.6430676509893269,9780394800165,9780394800165,True
1422,Covers_5302,Amazon_12229,Dialectic of Enlightenment: Philosophical Fragments (Cultural Memory of the Present (Paperback)),Dialectic of Enlightenment,0.5827315003059953,9780804736336,9780804736336,True
1423,Covers_3985,Amazon_4255,Learn to Earn : A Beginner's Guide to the Basics of Investing and Business,Learn to Earn,0.6375227787721849,9780684811635,9780684811635,True
1424,Covers_3384,Amazon_16123,DICTIONARY OF ANGELS: INCLUDING THE FALLEN ANGELS,Dictionary of Angels,0.7517473211963366,9780029070529,9780029070529,True
1425,Covers_1260,Amazon_8105,Zen in the Art of Writing: Essays on Creativity : Expanded,Zen in the Art of Writing,0.6376705461196323,9781877741098,9781877741098,True
1426,Covers_7272,Amazon_6062,Just for Fun: The Story of an Accidental Revolutionary,Just for Fun,0.5967249920843583,9780066620732,9780066620732,True
1427,Covers_485,Amazon_7715,The Moonstone (Wordsworth Classics),The Moonstone,0.7496277261142011,9781853260445,9781853260445,True
1428,Covers_6935,Amazon_10994,Feeling Good : The New Mood Therapy,Feeling Good,0.630246548652053,9780380810338,9780380810338,True
1429,Covers_4452,Amazon_1238,Biomimicry : Innovation Inspired by Nature,Biomimicry,0.5634811190436739,9780060533229,9780060533229,True
1430,Covers_5215,Amazon_9046,Michael Caine - Acting in Film (The Applause Acting Series),Acting in Film,0.713262654715681,9781557832771,9781557832771,True
1431,Covers_2852,Amazon_12032,Makers of Rome: Nine Lives by Plutarch (Penguin Classics),The Makers of Rome,0.5707474949902569,9780140441581,9780140441581,True
1432,Covers_3553,Amazon_15570,Medea (Dover Thrift Editions),Medea,0.6278376855207701,9780486275482,9780486275482,True
1433,Covers_2287,Amazon_11029,Baby Love: Everything You Need to Know About Your Baby's First Year,Baby Love,0.565204123060687,9780871319852,9780871319852,True
1434,Covers_4430,Amazon_15600,The Tain: Translated from the Irish Epic Tain Bo Cuailnge,The Tain,0.707778081982609,9780192803733,9780192803733,True
1435,Covers_3903,Amazon_16770,"The Road Less Traveled, 25th Anniversary Edition : A New Psychology of Love, Traditional Values and Spiritual Growth","Road Less Traveled, 25th Anniversar",0.5299050563911331,9780743243155,9780743243155,True
1436,Covers_1473,Amazon_18213,The Mammoth Hunters (Earth's Children (Paperback)),The Mammoth Hunters,0.7642191054663577,9780553280944,9780553280944,True
1437,Covers_2347,Amazon_3269,Story of Philosophy: The Lives and Opinions of the World's Greatest Philosophers,The Story of Philosophy,0.5131958603261173,9780671739164,9780671739164,True
1438,Covers_5312,Amazon_1579,The Logic of Scientific Discovery (Routledge Classics),The Logic of Scientific Discovery,0.7946778460529279,9780415278447,9780415278447,True
1439,Covers_4948,Amazon_7763,A Highland Christmas (Hamish Macbeth Mysteries (Paperback)),A Highland Christmas,0.565056692132874,9780446609197,9780446609197,True
1440,Covers_3228,Amazon_11546,A Brief History of the Druids (Brief Histories S.),A Brief History of the Druids,0.864904785737843,9781841194684,9781841194684,True
1441,Covers_2279,Amazon_14434,The Log from the Sea of Cortez (Penguin Great Books of the 20th Century),The Log from the Sea of Cortez,0.7684245511382071,9780140187441,9780140187441,True
1442,Covers_1601,Amazon_11813,Distant Mirror: The Calamitous Fourteenth Century,A Distant Mirror,0.5826484066445862,9780345349576,9780345349576,True
1443,Covers_3569,Amazon_10476,Asterix and the Normans (Asterix (Orion Paperback)),Asterix: Asterix and the Normans,0.8655307170750095,9780752866239,9780752866239,True
1444,Covers_6065,Amazon_941,Bioenergetics (Arkana S.),Bioenergetics,0.7662661441907584,9780140194715,9780140194715,True
1445,Covers_4525,Amazon_13719,The Way of the Shaman : Tenth Anniversary Edition,The Way of the Shaman,0.6847374374762011,9780062503732,9780062503732,True
1446,Covers_8747,Amazon_663,"Too Good to Leave, Too Bad to Stay: A Step-By-Step Guide to Helping You Decide Whether to Stay in or Get Out of Your Relationship","Too Good to Leave, Too Bad to Stay",0.6792547078164829,9780452275355,9780452275355,True
1447,Covers_482,Amazon_17947,Red Mars (Mars Trilogy),Red Mars,0.8973417332632794,9780553560732,9780553560732,True
1448,Covers_4685,Amazon_11674,Madness and Civilization: A History of Insanity in the Age of Reason,Madness and Civilization,0.5892212255261087,9780679721109,9780679721109,True
1449,Covers_4801,Amazon_11014,The Heart of Yoga: Developing a Personal Practice,The Heart of Yoga,0.5935667023628047,9780892817641,9780892817641,True
1450,Covers_1670,Amazon_17807,The Strange Case of Dr. Jekyll and Mr. Hyde (Dover Thrift Editions),The Strange Case of Dr. Jekyll and Mr. Hyde,0.8561501030065307,9780486266886,9780486266886,True
1451,Covers_3675,Amazon_18065,Call of the Wild and White Fang (Wordsworth Collection),Call of the Wild & White Fang,0.8306319168320564,9781853260261,9781853260261,True
1452,Covers_3688,Amazon_2834,Letters from a Stoic: Epistulae Morales Ad Lucilium (The Penguin Classics L210),Letters from a Stoic,0.449103348753516,9780140442106,9780140442106,True
1453,Covers_3238,Amazon_9071,The Art of Practicing: A Guide to Making Music from the Heart,Art Of Practicing,0.6421159601072678,9780609801772,9780609801772,True
1454,Covers_1676,Amazon_16817,Rome Sweet Home: Our Journey to Catholicism,Rome Sweet Home,0.6447522081616532,9780898704785,9780898704785,True
1455,Covers_8055,Amazon_3689,The Art of Possibility: Transforming Professional and Personal Life,The Art of Possibility,0.626300333192677,9780142001103,9780142001103,True
1456,Covers_1595,Amazon_20189,What Jane Austen Ate and Charles Dickens Knew: From Fox Hunting to Whist-The Facts of Daily Life in Nineteenth-Century England,What Jane Austen Ate and Charles Dickens Knew,0.650767686599793,9780671882365,9780671882365,True
1457,Covers_8465,Amazon_3525,"The Path to Power (The Years of Lyndon Johnson, Volume 1)",The Years of Lyndon Johnson,0.7905346806864777,9780679729457,9780679729457,True
1458,Covers_4940,Amazon_10463,Hellboy: Seed of Destruction (Hellboy),Hellboy Volume 1: Seed Of Destruction,0.8847249215901565,9781593070946,9781593070946,True
1459,Covers_666,Amazon_16604,Having a Mary Heart in a Martha World: Finding Intimacy With God in the Busyness of Life (Revised Edition with New Bible Study),Having a Mary Heart in a Martha World,0.5735833280718609,9781578562589,9781578562589,True
1460,Covers_7429,Amazon_3475,Maus a Survivors Tale: My Father Bleeds History,Maus: My Father Bleeds History v. 1,0.8416633916820463,9780394747231,9780394747231,True
1461,Covers_539,Amazon_18278,"Crossroads of Twilight (Wheel of Time, Book 10)",Crossroads of Twilight,0.7253996168145077,9780812571332,9780812571332,True
1462,Covers_3314,Amazon_8364,"Codes, Ciphers and Secret Writing (Test Your Code Breaking Skills)","Codes, Ciphers and Secret Writing",0.7349510409398057,9780486247618,9780486247618,True
1463,Covers_341,Amazon_17957,"Storm Front (The Dresden Files, Book 1)",Storm Front,0.6523635016660321,9780451457813,9780451457813,True
1464,Covers_4946,Amazon_16590,Taoist Secrets of Love: Cultivating Male Sexual Energy,Taoist Secrets of Love,0.5998626973617889,9780943358192,9780943358192,True
1465,Covers_2238,Amazon_15433,The Bhagavad Gita (Penguin Classics),The Bhagavad-gita,0.8671254958377044,9780140449181,9780140449181,True
1466,Covers_2469,Amazon_15477,"The Golden Days (The Story of the Stone, or The Dream of the Red Chamber, Volume 1)",The Story of the Stone: Golden Days Volume 1,0.7324320587819749,9780140442939,9780140442939,True
1467,Covers_4540,Amazon_4069,7 Strategies for Wealth &amp; Happiness: Power Ideas from America's Foremost Business Philosopher,7 Strategies For Wealth And Happiness,0.5645313732872931,9780761506164,9780761506164,True
1468,Covers_304,Amazon_17171,Heaven and Earth (Three Sisters Island Trilogy),Heaven and Earth,0.591788438201804,9780515132021,9780515132021,True
1469,Covers_3814,Amazon_15383,The Classic Tradition of Haiku: An Anthology (Dover Thrift Editions),The Classic Tradition of Haiku,0.7007968981452702,9780486292748,9780486292748,True
1470,Covers_8350,Amazon_11182,The Language of Letting Go (Hazelden Meditation Series),The Language Of Letting Go,0.7044691005896161,9780894866371,9780894866371,True
1471,Covers_6035,Amazon_3995,Getting Past No : Negotiating Your Way from Confrontation to Cooperation,Getting Past No,0.48833238302614373,9780553371314,9780553371314,True
1472,Covers_2335,Amazon_16626,Free Play: Improvisation in Life and Art,Free Play,0.5821593767418627,9780874776317,9780874776317,True
1473,Covers_7046,Amazon_18268,"God Emperor of Dune (Dune Chronicles, Book 4)",God Emperor of Dune,0.8826852714678262,9780441294671,9780441294671,True
1474,Covers_777,Amazon_13506,Reinventing Your Life: The Breakthrough Program to End Negative Behavior...and Feel Great Again,Reinventing Your Life,0.4408165184293541,9780452272040,9780452272040,True
1475,Covers_2729,Amazon_18395,Phenomenology of Spirit (Galaxy Books),Phenomenology of Spirit,0.782693702617775,9780198245971,9780198245971,True
1476,Covers_4384,Amazon_8496,Introducing Neuro-Linguistic Programming: Psychological Skills for Understanding and Influencing People,Introducing Neuro-Linguistic Programming,0.7061459423951225,9781855383449,9781855383449,True
1477,Covers_6258,Amazon_13981,Meditations from the Mat: Daily Reflections on the Path of Yoga,Meditations From The Mat,0.6480659424942758,9780385721547,9780385721547,True
1478,Covers_5473,Amazon_18748,"New York City Ballet Workout : Fifty Stretches And Exercises Anyone Can Do For A Strong, Graceful, And Sculpted Body",NYC Ballet Workout,0.3055493149453299,9780688152024,9780688152024,True
1479,Covers_1956,Amazon_15323,"The Waste Land, Prufrock and Other Poems (Dover Thrift Editions)","The Waste Land, Prufrock, and Other Poems",0.8346528963329801,9780486400617,9780486400617,True
1480,Covers_1660,Amazon_4673,Richard Scarry's A Day at the Airport (Pictureback),Richard Scarry's A Day at the Airport,0.8871911201184183,9780375812026,9780375812026,True
1481,Covers_2395,Amazon_15556,Top Girls (Methuen Modern Plays),"""Top Girls""",0.6030679810942818,9780413554802,9780413554802,True
1482,Covers_3479,Amazon_3586,The E-Myth Revisited: Why Most Small Businesses Don't Work and What to Do About It,The E-Myth Revisited,0.48100255189407987,9780887307287,9780887307287,True
1483,Covers_4437,Amazon_18739,When Pride Still Mattered : A Life Of Vince Lombardi,When Pride Still Mattered,0.7115106367229429,9780684870182,9780684870182,True
1484,Covers_8106,Amazon_1598,The Botany of Desire: A Plant's-Eye View of the World,"Botany of Desire, the",0.6547749280108325,9780375760396,9780375760396,True
1485,Covers_3816,Amazon_11589,On Liberty (Dover Thrift Editions),On Liberty,0.63958323582539,9780486421308,9780486421308,True
1486,Covers_4226,Amazon_20824,"Captain Underpants and the Big, Bad Battle of the Bionic Booger Boy, Part 1: The Night of the Nasty Nostril Nuggets",Captain Underpants #6: Captain Underpants & Big Bad Battle of Bionic Booger Boy Pt 1 Nostril Nugget,0.6926859793484283,9780439376105,9780439376105,True
1487,Covers_4591,Amazon_4307,The Meditations (Modern Library),The Meditations,0.6909875112169263,9780679642602,9780679642602,True
1488,Covers_6247,Amazon_3832,MAXIMUM ACHIEVEMENT: STRATEGIES AND SKILLS THAT WILL UNLOCK YOUR HIDDEN POWERS TO SUCCEED,Maximum Achievement,0.4827446397951592,9780684803319,9780684803319,True
1489,Covers_4460,Amazon_13809,Seth Speaks: The Eternal Validity of the Soul (A Seth Book),Seth Speaks,0.755282552709978,9781878424075,9781878424075,True
1490,Covers_3979,Amazon_15774,What Smart Students Know : Maximum Grades. Optimum Learning. Minimum Time.,What Smart Students Know,0.5676415504331274,9780517880852,9780517880852,True
1491,Covers_4672,Amazon_2450,Audition: Everything an Actor Needs to Know to Get the Part,Audition,0.46678660154890284,9780553272956,9780553272956,True
1492,Covers_1502,Amazon_13103,Asterix and Son (Asterix (Orion Paperback)),Asterix: Asterix and Son,0.8473673907164262,9780752847757,9780752847757,True
1493,Covers_5938,Amazon_15527,The Collected Poems of Rudyard Kipling (Wordsworth Poetry Library),Collected Poems of Rudyard Kipling,0.8269927265241477,9781853264054,9781853264054,True
1494,Covers_369,Amazon_15138,Self-Reliance and Other Essays (Dover Thrift Editions),Self Reliance,0.625120440361923,9780486277905,9780486277905,True
1495,Covers_8571,Amazon_8413,The Situation and the Story: The Art of Personal Narrative,The Situation and the Story,0.7031600926374896,9780374528584,9780374528584,True
1496,Covers_4296,Amazon_237,The Web That Has No Weaver : Understanding Chinese Medicine,The Web That Has No Weaver,0.7872724089700703,9780809228409,9780809228409,True
1497,Covers_5761,Amazon_20279,A Rainbow of My Own,Freeman Don : Rainbow of My Own,0.6799807302938028,9780140503289,9780140503289,True
1498,Covers_4261,Amazon_58,Loving What Is : Four Questions That Can Change Your Life,Loving What Is,0.5547183917214837,9781400045372,9781400045372,True
1499,Covers_1605,Amazon_11937,BELL CURVE : Intelligence and Class Structure in American Life (A Free Press Paperbacks Book),The Bell Curve,0.5095259609409161,9780684824291,9780684824291,True
1500,Covers_4398,Amazon_217,Without Conscience: The Disturbing World of the Psychopaths Among Us,Without Conscience,0.5193813145896086,9781572304512,9781572304512,True
1501,Covers_6212,Amazon_18394,Counting Kisses : A Kiss &amp; Read Book,Counting Kisses,0.7260274964711617,9780689856587,9780689856587,True
1502,Covers_2865,Amazon_15116,Complete Works of William Shakespeare (Wordsworth Royals Series),The Complete Works of William Shakespeare,0.7056194100816731,9781853268953,9781853268953,True
1503,Covers_4698,Amazon_2628,Grapefruit : A Book of Instructions and Drawings by Yoko Ono,Grapefruit,0.450755486244519,9780743201100,9780743201100,True
1504,Covers_8229,Amazon_15109,The Epic of Gilgamesh: The Babylonian Epic Poem and Other Texts in Akkadian and Sumerian (Penguin Classics),The Epic of Gilgamesh,0.5762021195835342,9780140449198,9780140449198,True
1505,Covers_3820,Amazon_12997,Wit and Wisdom of Mark Twain: A Book of Quotations (Dover Thrift Editions),The Wit and Wisdom of Mark Twain,0.7439253042122647,9780486406640,9780486406640,True
1506,Covers_4630,Amazon_15162,Haroun and the Sea of Stories (Puffin Books),Haroun and the Sea of Stories,0.8408597589261327,9780140366501,9780140366501,True
1507,Covers_6026,Amazon_798,The Power of Focusing: A Practical Guide to Emotional Self-Healing,The Power of Focusing,0.6247820217256703,9781572240445,9781572240445,True
1508,Covers_3567,Amazon_10232,Asterix at the Olympic Games (Asterix (Orion Paperback)),Asterix: Asterix at the Olympic Games,0.8813012854193664,9780752866277,9780752866277,True
1509,Covers_6085,Amazon_14160,My Side of the Mountain (Puffin Modern Classics),My Side of the Mountain,0.7374461116367333,9780142401118,9780142401118,True
1510,Covers_3943,Amazon_1724,"Voyage of the Beagle: Journal of Researches into the Natural History and Geology of the Countries Visited During the Voyage of H.M.S. Beagle Round the World, Under the (Classics of World Literature)",The Voyage of the Beagle,0.6703346930576325,9781853264764,9781853264764,True
1511,Covers_1671,Amazon_17551,Devil's Bride (Cynster Novels),Devil's Bride,0.6561259544003364,9780380794560,9780380794560,True
1512,Covers_5419,Amazon_15999,Match Wits With Mensa: The Complete Quiz Book (Mensa Genius Quiz),Match Wits With Mensa,0.7186683333011467,9780738202501,9780738202501,True
1513,Covers_3170,Amazon_790,500 Formulas For Aromatherapy: Mixing Essential Oils for Every Use,500 FORMULAS FOR AROMATHERAPY,0.6797522063343643,9780806905846,9780806905846,True
1514,Covers_619,Amazon_4893,Harold and the Purple Crayon 50th Anniversary Edition (Purple Crayon Books),Harold and the Purple Crayon,0.8572791031643984,9780064430227,9780064430227,True
1515,Covers_2065,Amazon_4149,"Awaken the Giant Within: How to Take Immediate Control of Your Mental, Emotional, Physical, and Financial",Awaken the Giant within,0.5283776400251867,9780671791544,9780671791544,True
1516,Covers_5803,Amazon_9254,Nourishing Traditions:  The Cookbook that Challenges Politically Correct Nutrition and the Diet Dictocrats,Nourishing Traditions,0.4672533553550855,9780967089737,9780967089737,True
1517,Covers_3236,Amazon_13908,Magical Aromatherapy: The Power of Scent (Llewellyn's New Age Series),Magical Aromatherapy,0.5627990810810125,9780875421292,9780875421292,True
1518,Covers_6673,Amazon_11168,Choice Theory : A New Psychology of Personal Freedom,Choice Theory,0.5905445549087793,9780060930141,9780060930141,True
1519,Covers_4371,Amazon_5314,"The Mythical Man-Month: Essays on Software Engineering, 20th  Anniversary Edition",The Mythical Man-Month,0.5988595995890406,9780201835953,9780201835953,True
1520,Covers_5838,Amazon_13588,Medicine Cards: The Discovery of Power Through the Ways of Animals,Medicine Cards,0.522083129248911,9780312204914,9780312204914,True
1521,Covers_4228,Amazon_3178,The Motorcycle Diaries : A Latin American Journey,The Motorcycle Diaries,0.7067544233430318,9781876175702,9781876175702,True
1522,Covers_7146,Amazon_16167,How Buildings Learn: What Happens After They're Built,How Buildings Learn: and Fail to Learn,0.45765587294861004,9780140139969,9780140139969,True
1523,Covers_1698,Amazon_9126,The Story of the Nutcracker Ballet (Picturebacks),Story Of The Nutcracker Ballet,0.833524832322326,9780394881782,9780394881782,True
1524,Covers_544,Amazon_7775,Imitation in Death (Eve Dallas Mysteries (Paperback)),Imitation in Death,0.6265451262454271,9780425191583,9780425191583,True
1525,Covers_4905,Amazon_15536,English Romantic Poetry: An Anthology (Dover Thrift Editions),English Romantic Poetry,0.6417729166288725,9780486292823,9780486292823,True
1526,Covers_5979,Amazon_20185,Caucasian Chalk Circle Mse,"""The ""Caucasian Chalk Circle""",0.8158328237639235,9780413544506,9780413544506,True
1527,Covers_6010,Amazon_1208,Structures: Or Why Things Dont Fall Down,Structures,0.4803038980364481,9780306812835,9780306812835,True
1528,Covers_6155,Amazon_11128,"A Volcano in My Tummy: Helping Children to Handle Anger : A Resource Book for Parents, Caregivers and Teachers",A Volcano in My Tummy,0.5216840690667115,9780865713499,9780865713499,True
1529,Covers_2555,Amazon_13947,Game of Life and How to Play It (Prosperity Classic),The Game of Life and How to Play it,0.7582434929117154,9780875162577,9780875162577,True
1530,Covers_5905,Amazon_1450,A Brief History of Science (Brief Histories Series),A Brief History of Science,0.8274555741310673,9781841195520,9781841195520,True
1531,Covers_5827,Amazon_14246,Pastured Poultry Profits,Pastured Poultry Profit$,0.7029165374811556,9780963810908,9780963810908,True
1532,Covers_4007,Amazon_4547,That's Not My Dinosaur (Touchy Feely Board Books),That's Not My Dinosaur,0.5902855772285381,9780746048146,9780746048146,True
1533,Covers_3582,Amazon_17359,A Room With a View (Penguin Twentieth-Century Classics),A Room with a View,0.6876942900833861,9780141183299,9780141183299,True
1534,Covers_8900,Amazon_18557,Zen in the Martial Arts,Zen In Martial Arts - Reissue,0.8565647808749444,9780553275599,9780553275599,True
1535,Covers_577,Amazon_13635,Let Your Life Speak: Listening for the Voice of Vocation,Let Your Life Speak,0.6020742413910585,9780787947354,9780787947354,True
1536,Covers_3825,Amazon_3461,Incidents in the Life of a Slave Girl (Dover Thrift Editions),Incidents in the Life of a Slave Girl,0.8029075910301269,9780486419312,9780486419312,True
1537,Covers_8056,Amazon_8609,The Art of the Personal Essay: An Anthology from the Classical Era to the Present,The Art of the Personal Essay,0.6381027621464475,9780385423397,9780385423397,True
1538,Covers_1428,Amazon_8030,The Devil's Dictionary (Dover Thrift Editions),The Devil's Dictionary,0.6321150375558614,9780486275420,9780486275420,True
1539,Covers_6079,Amazon_13428,"The Comedy Bible : From Stand-up to Sitcom--The Comedy Writer's Ultimate \How To\"" Guide""",The Comedy Bible: From Stand-up to Sitcom - The Comedy Writers Ultimate Guide,0.8991810343575043,9780743201254,9780743201254,True
1540,Covers_6256,Amazon_21991,Where the Suckers Moon: The Life and Death of an Advertising Campaign,Where The Suckers Moon,0.6588550316956778,9780679740421,9780679740421,True
1541,Covers_450,Amazon_6988,Picture of Dorian Gray (Wordsworth Classics),The Picture of Dorian Gray,0.837761136983382,9781853260155,9781853260155,True
1542,Covers_1938,Amazon_15070,Hamlet (Dover Thrift Editions),Hamlet,0.5923613072092159,9780486272788,9780486272788,True
1543,Covers_5344,Amazon_544,Fresh Vegetable and Fruit Juices: What's Missing in Your Body?,Fresh Vegetable and Fruit Juices,0.8115749286013514,9780890190333,9780890190333,True
1544,Covers_4310,Amazon_11055,Why Men Love Bitches: From Doormat to Dreamgirl-A Woman's Guide to Holding Her Own in a Relationship,Why Men Love Bitches,0.5050736573591066,9781580627566,9781580627566,True
1545,Covers_3850,Amazon_19685,Hildegard of Bingen's Medicine (Folk Wisdom Series),Hildegard of Bingen's Medicine,0.8026624852629635,9780939680443,9780939680443,True
1546,Covers_5406,Amazon_566,The Drama of Being a Child: The Search for the True Self,The Drama Of Being A Child,0.7238240920376299,9781860491016,9781860491016,True
1547,Covers_1569,Amazon_18934,"Richard Brautigan's Trout Fishing in America, The Pill versus The Springhill Mine Disaster, and In Watermelon Sugar",Trout Fishing in America,0.4772810711263529,9780395500767,9780395500767,True
1548,Covers_6480,Amazon_14909,Authentic Happiness : Using the New Positive Psychology to Realize Your Potential for Lasting Fulfillment,Authentic Happiness,0.423206177998241,9780743222983,9780743222983,True
1549,Covers_1886,Amazon_18924,In Search of Captain Zero: A Surfer's Road Trip Beyond the End of the Road,In Search of Captain Zero,0.5538842696835997,9781585421770,9781585421770,True
1550,Covers_3198,Amazon_7350,Father Brown: Selected Stories (Wordsworth Collection),The Complete Father Brown Stories,0.6150259711325836,9781853260032,9781853260032,True
1551,Covers_4038,Amazon_11119,All About Love: New Visions,All About Love,0.7042467028581967,9780060959470,9780060959470,True
1552,Covers_546,Amazon_20679,The SONG OF THE DODO: ISLAND BIOGEOGRAPHY IN AN AGE OF EXTINCTIONS,The Song of the Dodo,0.5790080269522051,9780684827124,9780684827124,True
1553,Covers_1419,Amazon_15098,Medea and Other Plays (Penguin Classics),Medea and Other Plays,0.8692185083734497,9780140441291,9780140441291,True
1554,Covers_6211,Amazon_12914,An Ideal Husband (Dover Thrift Editions),An Ideal Husband,0.7453355504197156,9780486414232,9780486414232,True
