,covers_id,amazon_id,covers_title,amazon_title,similarity_score,covers_isbn,amazon_isbn,is_match
1069,Covers_43825,Amazon_11428,"Samuel Pepys: The Man in the Making, 1633-1669",Mind in the Making,0.2728285819147685,9780586064702,9780061732324,False
1070,Covers_34040,Amazon_15083,Der Gaukler der K?nige.,Harry Potter Und Der Stein Der Weisen,0.2986238684943357,9783442355051,9783551354013,False
1071,Covers_8712,Amazon_13858,They Do It With Mirrors (Miss Marple Mysteries (Paperback)),I Can Do It,0.3226102969832373,9780451199904,9781401902193,False
1072,Covers_23645,Amazon_20527,"Poup?es, robots : La Culture pop japonaise",Rise of the Robots,0.292856381511105,9782746701908,9780465097531,False
1073,Covers_20157,Amazon_12544,A Garden of Pomegranates: Skrying on the Tree of Life,Life in the Garden,0.37882615527581176,9781567181418,9780241982181,False
1074,Covers_48680,Amazon_11550,"Before Freedom, When I Just Can Remember: Twenty-Seven Oral Histories of Former South Carolina Slaves",The Histories,0.27332111001892867,9780895870698,9780140449082,False
1075,Covers_5877,Amazon_2803,Playback (Vintage Crime),Born A Crime,0.3032985710069805,9780394757667,9781473635302,False
1076,Covers_24766,Amazon_6075,A Perfect Performance (Regency Romance),Systems Performance,0.3989107336572582,9780451171047,9780133390094,False
1077,Covers_46181,Amazon_11006,Mrs. Harris: The Death of the Scarsdale Diet Doctor,The 5:2 Diet Book,0.3313338046012926,9780151769025,9781409146698,False
1078,Covers_47924,Amazon_13851,Essential Care of Chameleons,Care Of The Soul,0.372316979367627,9781882770519,9780749941208,False
1079,Covers_15224,Amazon_20364,Mastering Your Hidden Self: A Guide to the Huna Way (A Quest Book),The Quest,0.3581710240222391,9780835605915,9780143121947,False
1080,Covers_23238,Amazon_2521,Llanto Por la Tierra Amada,La La Land,0.22513470868691954,9788440673923,9780571539826,False
1081,Covers_25767,Amazon_11180,"Gabriel Hawk'S Lady (The Protectors) (Harlequin Silhouette Intimate Moments, No 830)",The Gabriel Method,0.31015550123892877,9780373078301,9781582702186,False
1082,Covers_16871,Amazon_12369,"Fugitive Father (Intrigue , No 475)",My Father's Daughter,0.2451450963788872,9780373224753,9780446557313,False
1083,Covers_22638,Amazon_20566,"Energy Up!: Shed Pounds, Get Fit, Gain Stamina, and Turn on Your Power With This Unique Program",Energy,0.2606017354875652,9780399143113,9781786071330,False
1084,Covers_11391,Amazon_17052,Practical Celtic Magic: A Working Guide to the Magical Heritage of the Celtic Races,Practical Magic,0.34214328710616587,9780850306248,9781471169199,False
1085,Covers_30310,Amazon_11570,Das fehlende Glied in der Kette.,Das Reich,0.18993152382815098,9783502517832,9780330509985,False
1086,Covers_5527,Amazon_19798,For Keepsies: Stories,Learning Stories,0.23387357839311837,9781566890137,9780857020932,False
1087,Covers_17231,Amazon_13778,"Night of the Living Rat (Melvinge of the Megaverse, Book 2)",The Art of Living,0.3173549684834004,9780441910793,9780060637248,False
1088,Covers_49061,Amazon_8970,Het zomert in Barakstad,Queen in 3-D,0.08822074734975126,9789038802732,9781999667429,False
1089,Covers_23813,Amazon_14771,Good Families Don't,Good Life,0.3998392189698777,9780440405658,9780805209709,False
1090,Covers_16798,Amazon_22020,Great Indian Middle Class,Indian Motorcycle(R),0.36329264556524465,9780140276589,9780760348635,False
1091,Covers_9363,Amazon_19317,"Carnal Love: Poems (Sun and Moon Classics, No 121)",Sun and Moon Tarot,0.39394881325289555,9781557132727,9781572816596,False
1092,Covers_46965,Amazon_17053,"King Javan's Year (The Heirs of Saint Camber, Vol 2)",The King,0.2967555562249168,9780345332608,9780451417060,False
1093,Covers_3100,Amazon_14573,Sing Down the Moon (Laurel-Leaf Historical Fiction),The Moon,0.3470965285845529,9780440979753,9781788162548,False
1094,Covers_38555,Amazon_15985,James McNair Cooks Southeast Asian,China's Asian Dream,0.2869512873878188,9780811804530,9781783609239,False
1095,Covers_24269,Amazon_15083,Echnaton. Im Zeichen der Sonne.,Harry Potter Und Der Stein Der Weisen,0.15303909761527396,9783499227400,9783551354013,False
1096,Covers_12576,Amazon_1202,Absahnen und abhauen. Deutschland vor dem Chaos.,Chaos,0.33407535068480093,9783426774779,9780749386061,False
1097,Covers_32472,Amazon_7537,"West to a Land of Plenty: The Diary of Teresa Angelino Viscardi, New York to Idaho Territory, 1883 (Dear America)",Idaho,0.29350652462926313,9780590738880,9780099593959,False
1098,Covers_43095,Amazon_1943,The Shirley Temple Story,Story,0.3524411546935523,9780399127984,9780413715609,False
1099,Covers_34500,Amazon_3306,Light This Candle : The Life &amp; Times of Alan Shepard--America's First Spaceman,First Light,0.3342786841728689,9780609610015,9780141042756,False
1100,Covers_36424,Amazon_7354,Bill Baileys Daughter,The Daughter Of Time,0.3309870429897794,9780593014318,9780099536826,False
1101,Covers_44879,Amazon_9034,Modern Painting: The Impressionists--And the Avant-Garde of the Twentieth Century,Twentieth-Century Harmony,0.30628688540485516,9780764151194,9780393095395,False
1102,Covers_22477,Amazon_3251,Heart Seizure : A Novel,The Heart Of A Woman,0.28088776785502023,9780380977581,9781844085040,False
1103,Covers_19519,Amazon_2596,The Lover's Companion: Romantic Inspiration &amp; Creative Ideas,Romantic Country,0.31143400199896715,9781570715167,9781250094469,False
1104,Covers_35053,Amazon_21008,Las Giganteas/ the Amazons (Plaza &amp; Jans/literaria),Swallows and Amazons,0.27192828019736187,9788401380099,9780099572794,False
1105,Covers_3473,Amazon_3251,"Don't Be Afraid, Gringo: A Honduran Woman Speaks From The Heart : The Story of Elvia Alvarado",The Heart Of A Woman,0.3205819488672913,9780060972059,9781844085040,False
1106,Covers_11325,Amazon_10271,Collected Ghost Stories (Classics Library (NTC)),Ghost World,0.34569344551435205,9781853260537,9780224060882,False
1107,Covers_5843,Amazon_4835,Worst Enemies/Best Friends (Beacon Street Girls),The Worst Witch,0.29286552096847995,9780974658766,9780141349596,False
1108,Covers_18656,Amazon_5518,"The First Line: Starfleet Intelligence Manual (Stra Trek, the Next Generation)",On Intelligence,0.2810315034626149,9780671040055,9780805078534,False
1109,Covers_32215,Amazon_7057,Sharon O'Connor's Menus and Music/a Menu Cookbook With Musical Cassette for Dinner and Dessert,The Dinner,0.29026686866645285,9780961515003,9780857897206,False
1110,Covers_16456,Amazon_4400,Little Time In Texas,A Little Life,0.3727437334807094,9781551666297,9781447294832,False
1111,Covers_23889,Amazon_16310,Yule: A Celebration of Light and Warmth,Celebration of Discipline,0.3173633161208855,9781567184969,9780340979266,False
1112,Covers_42727,Amazon_903,Wolfy and the Strudelbakers,The Mind and the Brain,0.09901118066731478,9781899235384,9780060988470,False
1113,Covers_13248,Amazon_357,Hymnbook Orange Large Spiral,The Upward Spiral,0.3400291936610189,9780875790138,9781626251205,False
1114,Covers_19174,Amazon_914,The Ragman's Memory (Joe Gunther Mysteries (Paperback)),The Memory Book,0.3513798065196124,9780446605908,9781406644265,False
1115,Covers_9890,Amazon_6051,El nio republicano (Extra Alfaguara),Extra Lives,0.32611856360826674,9788420428703,9780307474315,False
1116,Covers_4382,Amazon_17455,In Search of Duende (New Directions Bibelot Series),The Search,0.3187103137657545,9780811213769,9780749941840,False
1117,Covers_34704,Amazon_3993,"Daring Deception (Harlequin Regency Romance, No 102)",The Art of Deception,0.33270594828855093,9780373312023,9780764542800,False
1118,Covers_11062,Amazon_8325,"Fun With Mommy and Me: More Than 300 Together-Time Activities for You and Your Child, Birth to Age Five",Fun for Starters Student's Book with Online Activities with Audio and Home Fun Booklet 2,0.30970914320354437,9780525946205,9781316617465,False
1119,Covers_24627,Amazon_5486,Las Historias Prohibidas De Marta Veneranda/the Forbidden Stories of Marta Veneranda,Forbidden Lego,0.16043249814751134,9781583220535,9781593271374,False
1120,Covers_23221,Amazon_7807,"Medicine on Trial: The Appalling Story of Ineptitude, Malfeasance, Neglect, and Arrogance",The Trial,0.3047240540836525,9780135735442,9780805209990,False
1121,Covers_12683,Amazon_19792,The Laird,The Story of the World,0.08835786344055256,9780515133882,9781933339054,False
1122,Covers_22327,Amazon_9873,Lieber die Taube in der Hand.,A Bird in the Hand,0.3082612821184141,9783492217880,9781845338961,False
1123,Covers_20378,Amazon_15083,Bienzle und der Klinkenm?rder.,Harry Potter Und Der Stein Der Weisen,0.25072807980302864,9783499229398,9783551354013,False
1124,Covers_49068,Amazon_21831,Warum und wohin? Gesammelte Notizen aus dem besch?digten Leben.,Nissan Patrol (Aus),0.12267349734215856,9783548363394,9781620921142,False
1125,Covers_24673,Amazon_1018,"The Hidden Connections: Integrating The Biological, Cognitive, And Social Dimensions Of Life Into A Science Of Sustainability",The Hidden Life of Trees,0.2681921222918871,9780385494717,9781771642484,False
1126,Covers_15767,Amazon_11984,Streams in the Desert &amp; Springs in the Valley,Queen of the Desert,0.3185372573464135,9780310210382,9781447286264,False
1127,Covers_18651,Amazon_21513,Cmo mejorar su autoestima,SU Carburettors Tuning Tips and Techniques,0.2112656124113367,9788475094885,9781855202559,False
1128,Covers_33961,Amazon_3534,Auf der Suche nach Marie.,Marie Antoinette,0.31405291640082983,9783492229692,9780753813058,False
1129,Covers_35330,Amazon_20916,Perfect Trust: A Rowan Gant Investigation,Rowan of Rin,0.31450811980704935,9780967822198,9780060560713,False
1130,Covers_7181,Amazon_3059,I Thought My Father Was God: And Other True Tales from NPR's National Story Project,Dreams From My Father,0.3372601963539677,9780312421007,9781782119258,False
1131,Covers_37764,Amazon_642,"Milady's Hairstyling : Men's, Women's and Children's Styles",Character Styles,0.3301462577043563,9781562531546,9780393701715,False
1132,Covers_266,Amazon_12356,Second Helpings : A Novel,Second Nature,0.3324422869923395,9780609807910,9780802140111,False
1133,Covers_17220,Amazon_18501,Cuando Digo Magdalena (Biblioteca del sur),Camino del Norte,0.13351359073150793,9789507422379,9781947474109,False
1134,Covers_33242,Amazon_15144,Measure of Her Powers: An M. F. K. Fisher Reader,Her,0.35336538369483783,9781582430317,9780997426588,False
1135,Covers_42890,Amazon_2871,"Ten copycats in a boat, and other riddles (An I can read book)",The Boys In The Boat,0.29799830033003627,9780060252373,9781447210986,False
1136,Covers_40852,Amazon_12328,Imani in Young Love &amp; Deception,Young House Love,0.3922742342664075,9780970622600,9781579654788,False
1137,Covers_47425,Amazon_21089,"Logan Likes Maryanne (Baby-Sitters Club, 10)",The Baby-Sitters Club Graphix #1-4 Box Set: Full-Color Edition,0.27762102734628247,9780590411240,9781338118988,False
1138,Covers_12453,Amazon_14485,Chutes and Adders: A Robin Light Mystery (Partners in Crime),The Robin,0.3589319031547269,9780821749975,9781910931318,False
1139,Covers_22628,Amazon_11570,Khalid. Das Schwert Gottes.,Das Reich,0.20630851458784433,9783548252025,9780330509985,False
1140,Covers_21019,Amazon_17581,The Tentmaker (Lily Connor Mysteries (Paperback)),Red Lily,0.3548809977454802,9780425176689,9780515139402,False
1141,Covers_11482,Amazon_19792,The mint lawn,The Story of the World,0.06110268342519517,9781863730167,9781933339054,False
1142,Covers_28788,Amazon_7116,Lewis and Clark and Me: A Dog's Tale,The Lewis Man,0.39647282727670297,9780805063684,9780857382221,False
1143,Covers_44508,Amazon_18066,Green Mansions--A Romance of the Tropical Forest,Daughter of the Forest,0.34944450144186845,9781404304604,9780765343437,False
1144,Covers_34606,Amazon_6422,Ein Landarzt und andere Drucke zu Lebzeiten.,Die Welt unter der Lupe - zu Wasser,0.13128892652882973,9783596124411,9783404609499,False
1145,Covers_48685,Amazon_2721,"Does This Make Me Look Fat?: The Definitive Rules for Dressing Thin for Every Height, Size, and Shape",Dressing the Man,0.29086583294235724,9780812967654,9780060191443,False
1146,Covers_27227,Amazon_15200,Born Rich-27dp: Tragedy FL,The Birth of Tragedy,0.2858181789624022,9780312922962,9780486285153,False
1147,Covers_32194,Amazon_7569,Winter Eyes (Stonewall Inn Editions (Paperback)),Winter,0.39106556260524505,9780312105761,9780241973332,False
1148,Covers_23535,Amazon_11803,One God Clapping: The Spiritual Path of a Zen Rabbi,The Path,0.36776276883742354,9781568362878,9780241970423,False
1149,Covers_20395,Amazon_13782,"The Good Spell Book : Love Charms, Magical Cures, and Other Practical Sorcery",The Witches' Spell Book,0.29965792716479406,9780316488396,9780762450817,False
1150,Covers_34441,Amazon_17458,Music Minus One: Poems,The One,0.34744252288174643,9780312146863,9781785035623,False
1151,Covers_20282,Amazon_10494,Paraph of Bone &amp; Other Kinds of Blue,Bone: v.1,0.3949091665769479,9780966339574,9781888963144,False
1152,Covers_37685,Amazon_1710,Die Mechanismen der Freude. Erz?hlungen.,To Die For,0.20237664392752835,9783257212426,9780007264094,False
1153,Covers_20154,Amazon_17158,The Unvanquished: The Corrected Text,The Women in Black: Text Classics,0.32471104475010826,9780679736523,9781921922299,False
1154,Covers_34384,Amazon_16269,A Thousand Acres,One Thousand Gifts,0.3858626114553023,9780394577739,9780310321910,False
1155,Covers_27635,Amazon_13442,Adam Bede (Oxford World's Classics),The Best of Adam Sharp,0.31643369416905676,9780192834959,9781405918084,False
1156,Covers_6772,Amazon_16947,Dear and Glorious Physician,Dear John,0.35913644692548397,9780553227888,9780446567336,False
1157,Covers_33958,Amazon_8290,"Say Goodnight, Gracie (Zebra Historical Romance)","""They Say / I Say""",0.3568135136174147,9780821774571,9780393935844,False
1158,Covers_36708,Amazon_7421,I Knew You Would Call: A Marta Goicochea Mystery,The Long Call,0.2377433990262674,9780934678704,9781509889570,False
1159,Covers_33634,Amazon_15584,"Eurydice, suivi de \Rom?o et Jeannette\""""",No et moi,0.18451241439372798,9782070372188,9782253124801,False
1160,Covers_15019,Amazon_4035,Year What Life Was Like At the Turn,The 100-Year Life,0.3659358214588682,9780316643757,9781472947321,False
1161,Covers_21879,Amazon_8332,Roast Beef in April an Autobiographical Sketch of the '30's &amp; '40's,How to Write an Autobiographical Novel,0.30868253156299463,9780963793621,9781526609113,False
1162,Covers_13815,Amazon_9892,Bar sport duemila (I narratori/Feltrinelli),Bar Book,0.3594045252691739,9788807015298,9781452113845,False
1163,Covers_14817,Amazon_20651,"Wordsworth: Poetical Works (Oxford Paperbacks, 192)",The Works,0.31852560243611927,9780192810526,9780143112709,False
1164,Covers_32505,Amazon_6586,Starring Mothers: 30 Portraits of Accomplished Women,A-Z of Flower Portraits,0.3356341363350974,9780385231183,9781844484522,False
1165,Covers_25169,Amazon_16004,GREAT GHOST SHOW (Real Ghostbusters),Show and Tell,0.3333103542591641,9780671645694,9780241004371,False
1166,Covers_19485,Amazon_5076,The Television Crimebusters Omnibus,Asterix: Omnibus 1,0.3456882236800949,9781857979497,9781444004236,False
1167,Covers_9545,Amazon_11172,Horse Magic (Saddle Club (Paperback)),1-2-3 Magic,0.3909748797123953,9780553482652,9781492629887,False
1168,Covers_19238,Amazon_20889,David Starr: Space Ranger,The Royal Ranger (Ranger's Apprentice Book 12),0.39792598537245244,9780345315410,9780440869948,False
1169,Covers_10233,Amazon_21417,The Virgin Encyclopedia of the Blues (Virgin Encyclopedias of Popular Music),Baby Blues,0.2343801768425996,9780753502266,9780809239962,False
1170,Covers_36677,Amazon_6959,"Determined Husband (Red Hot Revenge) (Harlequin Presents, No 2183)",The Husband's Secret,0.2653880133387119,9780373121830,9781405911665,False
1171,Covers_42795,Amazon_2313,"Que Vivimos Solos, Los",100 Of The Most Beautiful Piano Solos Ever,0.30501173723132224,9788475094984,9781476814766,False
1172,Covers_20943,Amazon_2669,Tales of Mystery and Imagination (Classics Library (NTC)),The Library Of Piano Classics,0.34842379680425245,9781853260131,9780825611117,False
1173,Covers_15587,Amazon_2809,No Blood Spilled,Bad Blood,0.326677002237466,9780812509328,9781509868087,False
1174,Covers_23728,Amazon_7605,"Karen's New Holiday (Baby-Sitters Little Sister, 112)",The Holiday,0.3657833791750065,9780590523769,9781785767708,False
1175,Covers_20453,Amazon_19002,Das Dritte Auge. Ein Tibet- Roman. ( Grenzwissenschaften/ Esoterik).,Lonely Planet Tibet,0.2450729277651246,9783442117581,9781742200460,False
1176,Covers_9834,Amazon_14469,Who Let the Dogs In? : Incredible Political Animals I Have Known,Dogs,0.34462245009047465,9781400062850,9780226115634,False
1177,Covers_40963,Amazon_3962,Nobody Ever Sees You Eat Tuna Fish,Fish!,0.3620427923006497,9780425098998,9781444792805,False
1178,Covers_32078,Amazon_16079,The Multilingual Self: An Inquiry into Language Learning,Guided Inquiry Design (R),0.2959571923749655,9780805823202,9781610690096,False
1179,Covers_34836,Amazon_16359,Viet Vet Survival Guide: How to Cut Through the Bureaucracy and Get What You Need-And Are Entitled to,You Are What You Love,0.2760421759500179,9780345321275,9781587433801,False
1180,Covers_43581,Amazon_6964,Ladies' Room Reader: The Ultimate Women's Trivia Book,Room,0.3972800213527785,9781573245579,9780330519021,False
1181,Covers_10314,Amazon_3536,Prayers on My Pillow: Inspiration for Girls on the Threshold of Change,The Pillow Book,0.37387489111929173,9780345426734,9780140448061,False
1182,Covers_38727,Amazon_15870,The Music Men: The Story of Professional Gospel Quartet Singing in America,The Gospel of John,0.3495560278573433,9781878894007,9780801036477,False
1183,Covers_3096,Amazon_11135,Wanda Hickey's Night of Golden Memories: And Other Disasters,Memories,0.33958577529871053,9780385116329,9781449472399,False
1184,Covers_41516,Amazon_15737,Der Zauber von Oxmoon. Roman.,Roman Lives,0.2243976223015163,9783442351145,9780199537389,False
1185,Covers_9904,Amazon_11982,"Nanny In The Family (Harlequin Presents, No 1950)",The Family,0.3666668376607809,9780373119509,9780060560058,False
1186,Covers_8333,Amazon_4349,The Inquisitors' Manual,Style Manual,0.3300201713899446,9780802140524,9780701636487,False
1187,Covers_44635,Amazon_11285,"Baby Scrapbooks: Ideas, Tips, and Techniques for Baby Scrapbooks",The Baby Book,0.3434539473316688,9781892127099,9780316198264,False
1188,Covers_15048,Amazon_7106,"Thin Ice: The Complete, Uncensored Story of Tonya Harding",Thin Air,0.2719658769692541,9780786000616,9781447202103,False
1189,Covers_45563,Amazon_18635,"Going Back (American Romance, No 255)",Going Long,0.31072612512909265,9780373162550,9781934030066,False
1190,Covers_28167,Amazon_3125,"That Woman In Wyoming (Hometown U.S.A.) (Harlequin Superromance, No 974)",That Woman,0.3851034178315186,9780373709748,9780753827390,False
1191,Covers_49124,Amazon_9172,Le Meilleur Des Mondes,Le Freak,0.20368882010899297,9782266023108,9780751542776,False
1192,Covers_23435,Amazon_3371,"A nice night's entertainment: Sketches and monologues, 1956-1981",Mr Nice,0.26711326599572943,9780868190471,9780749395698,False
1193,Covers_17865,Amazon_21546,How to Organize Your Scrapbook Workspace: Storage Solutions for Any Budget,How to Build a Bobber on a Budget,0.25470830863041666,9781892127181,9780760327852,False
1194,Covers_20487,Amazon_7600,Three Entertainments: A Gun for Sale/the Confidential Agent/the Ministry of Fear,Agent 6,0.35266432853622803,9780140173635,9781847396747,False
1195,Covers_21373,Amazon_3071,"Going In Style / I Love Lacy (Harlequin Duets 2-In-1, #50)",Love x Style x Life,0.3641307404206443,9780373441167,9781471149450,False
1196,Covers_34573,Amazon_18366,Dom Casmurro: A Novel (Library of Latin America),Open Veins of Latin America,0.3121214256858672,9780195103083,9781846687426,False
1197,Covers_6074,Amazon_4639,The Pride of Chanur (Chanur),Pride and Prejudice,0.22996512592158325,9780886772925,9781853260001,False
1198,Covers_49399,Amazon_11731,Anatomy of a Crusade: 1213-1221 (Middle Ages Series),A Brief History of Life in the Middle Ages,0.3489447017575561,9780812213232,9781845296858,False
1199,Covers_33401,Amazon_1709,The McGill Report on Male Intimacy,The Male Brain,0.3590959468132588,9780030632976,9780553824872,False
1200,Covers_16011,Amazon_7732,"Murder in Jamaica.: The Adventures of Christiana and the Dreadlocks Cop, Mystery",The Murder Stone,0.20100717800156884,9780968264614,9780751547535,False
1201,Covers_11707,Amazon_13646,A Spy at Evening (Coronet Books),Morning & Evening Meditations,0.3315506605959574,9780340253908,9781401901400,False
1202,Covers_2799,Amazon_10271,Ghost Stories of an Antiquary,Ghost World,0.3838421698925951,9780486227580,9780224060882,False
1203,Covers_42741,Amazon_16131,Cane (Norton Critical Edition),Critical Mass,0.33187339932944154,9780393956009,9780099457862,False
1204,Covers_42704,Amazon_3297,Lehmanns Erz?hlungen oder So sch?n war mein Markt. Gro??druck. Aus den Bekenntnissen eines Schwarzh?ndlers.,War,0.15181910066296375,9783423251419,9780007337712,False
1205,Covers_15326,Amazon_7275,A Personal Devil: A Magdalene la Batarde Mystery,Personal,0.36288648017009945,9780312875930,9780857502674,False
1206,Covers_11746,Amazon_8882,Triple Trouble in Hollywood,Hollywood Babylon,0.3657435117392816,9780874067538,9780440153252,False
1207,Covers_48552,Amazon_20848,Breathless (Sonnet Books),The Little House Books,0.19504931902867936,9780671023683,9780064400404,False
1208,Covers_28871,Amazon_13418,Diva: The New Generation : The Sopranos and Mezzos of the Decade Discuss Their Roles,The Diva Rules,0.3202268467650514,9781555533588,9781452142326,False
1209,Covers_17966,Amazon_11334,The Complete Idiot's Guide to Starting Your Own Business (Serial),"Own the Day, Own Your Life",0.3584136784744956,9781567615296,9780008286415,False
1210,Covers_15176,Amazon_7064,The Truman Show: The Shooting Script,The Late Show,0.3441727480754406,9781557043672,9781409147558,False
1211,Covers_18127,Amazon_9431,Wonder Bread and Ecstasy: The Life and Death of Joey Stefano,Bread,0.3522157866495042,9781555833831,9781118132715,False
1212,Covers_15753,Amazon_19766,Kermit Learns Windows (A Muppet Computer Book),Little Witch Learns to Read,0.3007460994047045,9781559583664,9780375821790,False
1213,Covers_48599,Amazon_1710,Die Kinderkarawane.,To Die For,0.33749444959930114,9783423071819,9780007264094,False
1214,Covers_11320,Amazon_6770,"Pythagoras' Trousers: God, Physics, and the Gender Wars",Making Trousers for Men & Women,0.33593436237807534,9780393317244,9781589234499,False
1215,Covers_19930,Amazon_4849,"California Road Atlas and Driver's Guide, 1994",Road,0.3491837557440307,9780881306255,9780307386458,False
1216,Covers_30085,Amazon_7141,Renaissance Drama: An Anthology of Plays and Entertainments (Blackwell Anthologies),Renaissance,0.36014319769198505,9780631208037,9780141046303,False
1217,Covers_16057,Amazon_5847,Seven great detective stories,Seven Languages in Seven Weeks,0.3949618622016132,9780307216274,9781934356593,False
1218,Covers_30850,Amazon_6908,Ratner's Star (Vintage Contemporaries (Paperback)),Vintage Flowers,0.2394845145985678,9780679722922,9781856269711,False
1219,Covers_20166,Amazon_10219,"Strum Again? (The Songkiller Saga, Book 3)",Saga Book One,0.3353173734789723,9780553297058,9781632150783,False
1220,Covers_2337,Amazon_17365,From the Ashes of Sobibor: A Story of Survival (Jewish Lives),Ashes of Midnight,0.3626578034289114,9780810113022,9780440244509,False
1221,Covers_41819,Amazon_1710,Maskenscherz: Die frhen Erzhlungen,To Die For,0.2060541482423712,9783499127458,9780007264094,False
1222,Covers_6206,Amazon_9570,Report from Engine Co. 82,Death & Co,0.38734492314697805,9780446675529,9781607745259,False
1223,Covers_20122,Amazon_14674,Papa est au Panth?on,C'est La Folie,0.28426001883602897,9782070427536,9780553817324,False
1224,Covers_22547,Amazon_6481,The Age of Uncertainty: Points of Departure,all points patchwork,0.3078440978699973,9780395259474,9781612124209,False
1225,Covers_10385,Amazon_15062,"Hold the Cream Cheese, Kill the Lox : A Ruby, the Rabbi's Wife Mystery (Ruby, the Rabbi's Wife Mysteries)",The World's Wife,0.3561050012915205,9780684871561,9780330372220,False
1226,Covers_477,Amazon_11507,"Ghost Roads  (Buffy the Vampire Slayer: The Gatekeeper Trilogy, Book 2)",The Silk Roads,0.3078025311866151,9780671027490,9781408839997,False
1227,Covers_28528,Amazon_12319,"Cheetah Girls, The: Wishing on a Star - Book #1 (Cheetah Girls, No. 1)",Girls Style Book,0.34170472906885685,9780786813841,9780804843270,False
1228,Covers_19798,Amazon_715,The Constants of Nature : The Numbers That Encode the Deepest Secrets of the Universe (Vintage),The Deepest Well,0.34524079791791573,9781400032259,9781509823963,False
1229,Covers_30489,Amazon_451,Nostradamus: The Final Prophecies: A Revolutionary New Interpretation for Today's World,T A Today,0.33213650855857446,9780285636392,9781870244022,False
1230,Covers_18217,Amazon_20112,Acts of Revision: A Novel,Economics for the IB Diploma Revision Guide,0.38458540202223346,9780385482738,9781471807183,False
1231,Covers_31922,Amazon_7006,DEATH ROW WOMEN: SHOCKING STORIES OF AMERICAS MOST VICIOUS FEMALES,Vicious,0.38187529071503734,9780671793913,9781783290215,False
1232,Covers_48746,Amazon_20307,Highland Games: The Making of the Myth (Edinburgh Education and Society),Education of the Child,0.3278767421057236,9780748602445,9780880104142,False
1233,Covers_14509,Amazon_14411,Horse People: Scenes from the Riding Life,The Way of the Horse,0.33975718554907025,9780066212524,9781577315131,False
1234,Covers_10842,Amazon_6502,Yankee Doodle Dandy: Brian Mulroney and the American Agenda,Craft-a-Doodle,0.29048629540827897,9780773728806,9781454704225,False
1235,Covers_6250,Amazon_7689,Sharpe's Eagle: Richard Sharpe and the Talavera Campaign July 1809,4th of July,0.2284535306514365,9780451212573,9780446613361,False
1236,Covers_48607,Amazon_2521,La scomparsa di Majorana (Fabula),La La Land,0.22715019065001843,9788845912696,9780571539826,False
